{
  "version": 1,
  "enabled": true,
  "preset": "default",
  "terminal": {
    "widthMode": "full",
    "colorLevel": "ansi256"
  },
  "iconMode": "text",
  "minimalist": false,
  "separator": "none",
  "separatorFg": "pi:dim",
  "separatorBg": "default",
  "extensionStatusRow": {
    "hiddenKeys": [],
    "knownKeys": []
  },
  "lines": [
    [
      {
        "id": "agentcfg-selection",
        "type": "event",
        "enabled": true,
        "options": {
          "fg": "pi:text",
          "bg": "default",
          "bold": true,
          "raw": true,
          "hideWhenEmpty": true,
          "widgetId": "agentcfg-selection"
        }
      },
      {
        "id": "selection-thinking",
        "type": "separator",
        "enabled": true,
        "options": {
          "fg": "pi:dim",
          "bg": "default",
          "bold": false,
          "raw": true,
          "hideWhenEmpty": true,
          "separator": "custom",
          "text": " │ "
        }
      },
      {
        "id": "agentcfg-thinking",
        "type": "thinking-level",
        "enabled": true,
        "options": {
          "fg": "pi:warning",
          "bg": "default",
          "bold": false,
          "raw": false,
          "hideWhenEmpty": false,
          "icon": "THINK ",
          "text": "--"
        }
      },
      {
        "id": "thinking-provider",
        "type": "separator",
        "enabled": true,
        "options": {
          "fg": "pi:dim",
          "bg": "default",
          "bold": false,
          "raw": true,
          "hideWhenEmpty": true,
          "separator": "custom",
          "text": " │ "
        }
      },
      {
        "id": "agentcfg-provider",
        "type": "event",
        "enabled": true,
        "options": {
          "fg": "pi:accent",
          "bg": "default",
          "bold": false,
          "raw": true,
          "hideWhenEmpty": true,
          "widgetId": "agentcfg-provider"
        }
      },
      {
        "id": "provider-activity",
        "type": "separator",
        "enabled": true,
        "options": {
          "fg": "pi:dim",
          "bg": "default",
          "bold": false,
          "raw": true,
          "hideWhenEmpty": true,
          "separator": "custom",
          "text": " │ "
        }
      },
      {
        "id": "agentcfg-activity",
        "type": "event",
        "enabled": true,
        "options": {
          "fg": "pi:muted",
          "bg": "default",
          "bold": false,
          "raw": true,
          "hideWhenEmpty": true,
          "widgetId": "agentcfg-activity"
        }
      },
      {
        "id": "project-right",
        "type": "flex-separator",
        "enabled": true,
        "options": {}
      },
      {
        "id": "agentcfg-cwd-basename",
        "type": "cwd-basename",
        "enabled": true,
        "options": {
          "fg": "pi:muted",
          "bg": "default",
          "bold": false,
          "raw": true,
          "hideWhenEmpty": true
        }
      },
      {
        "id": "agentcfg-git-branch",
        "type": "git-branch",
        "enabled": true,
        "options": {
          "fg": "pi:muted",
          "bg": "default",
          "bold": false,
          "raw": false,
          "hideWhenEmpty": true,
          "icon": " / "
        }
      }
    ],
    [
      {
        "id": "agentcfg-context",
        "type": "event",
        "enabled": true,
        "options": {
          "fg": "pi:accent",
          "bg": "default",
          "bold": false,
          "raw": true,
          "hideWhenEmpty": true,
          "widgetId": "agentcfg-context"
        }
      },
      {
        "id": "context-meter",
        "type": "separator",
        "enabled": true,
        "options": {
          "fg": "pi:dim",
          "bg": "default",
          "bold": false,
          "raw": true,
          "hideWhenEmpty": true,
          "separator": "custom",
          "text": "  "
        }
      },
      {
        "id": "agentcfg-meter",
        "type": "event",
        "enabled": true,
        "options": {
          "fg": "default",
          "bg": "default",
          "bold": false,
          "raw": true,
          "hideWhenEmpty": true,
          "widgetId": "agentcfg-meter"
        }
      },
      {
        "id": "meter-tools",
        "type": "separator",
        "enabled": true,
        "options": {
          "fg": "pi:dim",
          "bg": "default",
          "bold": false,
          "raw": true,
          "hideWhenEmpty": true,
          "separator": "custom",
          "text": "  "
        }
      },
      {
        "id": "agentcfg-tools",
        "type": "event",
        "enabled": true,
        "options": {
          "fg": "pi:text",
          "bg": "default",
          "bold": false,
          "raw": true,
          "hideWhenEmpty": true,
          "widgetId": "agentcfg-tools"
        }
      }
    ],
    [
      {
        "id": "agentcfg-statistics",
        "type": "event",
        "enabled": true,
        "options": {
          "fg": "pi:text",
          "bg": "default",
          "bold": false,
          "raw": true,
          "hideWhenEmpty": true,
          "widgetId": "agentcfg-statistics"
        }
      },
      {
        "id": "usage-timing",
        "type": "separator",
        "enabled": true,
        "options": {
          "fg": "pi:dim",
          "bg": "default",
          "bold": false,
          "raw": true,
          "hideWhenEmpty": true,
          "separator": "custom",
          "text": "  "
        }
      },
      {
        "id": "agentcfg-timing",
        "type": "event",
        "enabled": true,
        "options": {
          "fg": "pi:muted",
          "bg": "default",
          "bold": false,
          "raw": true,
          "hideWhenEmpty": true,
          "widgetId": "agentcfg-timing"
        }
      }
    ]
  ]
}
